{
  "$schema": "https://json-schema.org/draft/2020-12/schema",
  "$id": "https://code.claude.com/schemas/marketplace.schema.json",
  "title": "Claude Code Plugin Marketplace",
  "description": "Schema for Claude Code marketplace.json files located in .claude-plugin/ directory",
  "type": "object",
  "required": ["name", "owner", "plugins"],
  "properties": {
    "name": {
      "type": "string",
      "description": "Marketplace identifier (kebab-case, no spaces). Users see this when installing plugins.",
      "pattern": "^[a-z][a-z0-9-]*$",
      "not": {
        "enum": [
          "claude-code-marketplace",
          "claude-code-plugins",
          "claude-plugins-official",
          "anthropic-marketplace",
          "anthropic-plugins",
          "agent-skills",
          "life-sciences"
        ]
      }
    },
    "owner": {
      "$ref": "#/$defs/owner",
      "description": "Marketplace maintainer information"
    },
    "metadata": {
      "type": "object",
      "properties": {
        "description": {
          "type": "string",
          "description": "Brief marketplace description"
        },
        "version": {
          "type": "string",
          "description": "Marketplace version"
        },
        "pluginRoot": {
          "type": "string",
          "description": "Base directory prepended to relative plugin source paths"
        }
      },
      "description": "Optional marketplace metadata"
    },
    "plugins": {
      "type": "array",
      "items": {
        "$ref": "#/$defs/pluginEntry"
      },
      "description": "List of available plugins"
    }
  },
  "$defs": {
    "owner": {
      "type": "object",
      "properties": {
        "name": {
          "type": "string",
          "description": "Name of the maintainer or team"
        },
        "email": {
          "type": "string",
          "format": "email",
          "description": "Contact email for the maintainer"
        }
      },
      "required": ["name"]
    },
    "author": {
      "type": "object",
      "properties": {
        "name": {
          "type": "string",
          "description": "Author name"
        },
        "email": {
          "type": "string",
          "format": "email",
          "description": "Author email"
        },
        "url": {
          "type": "string",
          "format": "uri",
          "description": "Author website or profile URL"
        }
      },
      "required": ["name"]
    },
    "pluginEntry": {
      "type": "object",
      "required": ["name", "source"],
      "properties": {
        "name": {
          "type": "string",
          "description": "Plugin identifier (kebab-case, no spaces)",
          "pattern": "^[a-z][a-z0-9-]*$"
        },
        "source": {
          "oneOf": [
            {
              "type": "string",
              "description": "Relative path to plugin directory"
            },
            {
              "$ref": "#/$defs/githubSource"
            },
            {
              "$ref": "#/$defs/urlSource"
            }
          ],
          "description": "Where to fetch the plugin from"
        },
        "description": {
          "type": "string",
          "description": "Brief plugin description"
        },
        "version": {
          "type": "string",
          "description": "Plugin version (semver)",
          "pattern": "^\\d+\\.\\d+\\.\\d+(-[a-zA-Z0-9.-]+)?(\\+[a-zA-Z0-9.-]+)?$"
        },
        "author": {
          "oneOf": [
            {
              "type": "string"
            },
            {
              "$ref": "#/$defs/author"
            }
          ],
          "description": "Plugin author information"
        },
        "homepage": {
          "type": "string",
          "format": "uri",
          "description": "Plugin homepage or documentation URL"
        },
        "repository": {
          "type": "string",
          "format": "uri",
          "description": "Source code repository URL"
        },
        "license": {
          "type": "string",
          "description": "SPDX license identifier (e.g., MIT, Apache-2.0)"
        },
        "keywords": {
          "type": "array",
          "items": {
            "type": "string"
          },
          "description": "Tags for plugin discovery and categorization"
        },
        "category": {
          "type": "string",
          "description": "Plugin category for organization"
        },
        "tags": {
          "type": "array",
          "items": {
            "type": "string"
          },
          "description": "Tags for searchability"
        },
        "strict": {
          "type": "boolean",
          "default": true,
          "description": "When true (default), plugin source must contain plugin.json. When false, marketplace entry defines everything."
        },
        "commands": {
          "oneOf": [
            {
              "type": "string"
            },
            {
              "type": "array",
              "items": {
                "type": "string"
              }
            }
          ],
          "description": "Custom paths to command files or directories"
        },
        "agents": {
          "oneOf": [
            {
              "type": "string"
            },
            {
              "type": "array",
              "items": {
                "type": "string"
              }
            }
          ],
          "description": "Custom paths to agent files"
        },
        "skills": {
          "oneOf": [
            {
              "type": "string"
            },
            {
              "type": "array",
              "items": {
                "type": "string"
              }
            }
          ],
          "description": "Custom paths to skill directories"
        },
        "hooks": {
          "oneOf": [
            {
              "type": "string",
              "description": "Path to hooks configuration file"
            },
            {
              "$ref": "#/$defs/hooksConfig"
            }
          ],
          "description": "Hook configuration (path to file or inline config)"
        },
        "mcpServers": {
          "oneOf": [
            {
              "type": "string",
              "description": "Path to MCP configuration file"
            },
            {
              "type": "object",
              "additionalProperties": {
                "$ref": "#/$defs/mcpServer"
              }
            }
          ],
          "description": "MCP server configuration"
        },
        "lspServers": {
          "oneOf": [
            {
              "type": "string",
              "description": "Path to LSP configuration file"
            },
            {
              "type": "object",
              "additionalProperties": {
                "$ref": "#/$defs/lspServer"
              }
            }
          ],
          "description": "LSP server configuration"
        }
      }
    },
    "githubSource": {
      "type": "object",
      "required": ["source", "repo"],
      "properties": {
        "source": {
          "type": "string",
          "const": "github",
          "description": "Source type identifier"
        },
        "repo": {
          "type": "string",
          "description": "GitHub repository in owner/repo format",
          "pattern": "^[a-zA-Z0-9_.-]+/[a-zA-Z0-9_.-]+$"
        },
        "ref": {
          "type": "string",
          "description": "Git branch or tag (defaults to repository default branch)"
        },
        "sha": {
          "type": "string",
          "description": "Full 40-character git commit SHA to pin to exact version",
          "pattern": "^[a-f0-9]{40}$"
        },
        "path": {
          "type": "string",
          "description": "Subdirectory within the repository"
        }
      }
    },
    "urlSource": {
      "type": "object",
      "required": ["source", "url"],
      "properties": {
        "source": {
          "type": "string",
          "const": "url",
          "description": "Source type identifier"
        },
        "url": {
          "type": "string",
          "format": "uri",
          "description": "Full git repository URL (must end with .git)",
          "pattern": "\\.git$"
        },
        "ref": {
          "type": "string",
          "description": "Git branch or tag (defaults to repository default branch)"
        },
        "sha": {
          "type": "string",
          "description": "Full 40-character git commit SHA to pin to exact version",
          "pattern": "^[a-f0-9]{40}$"
        }
      }
    },
    "hooksConfig": {
      "type": "object",
      "properties": {
        "PreToolUse": {
          "$ref": "#/$defs/hookEventConfig"
        },
        "PostToolUse": {
          "$ref": "#/$defs/hookEventConfig"
        },
        "PermissionRequest": {
          "$ref": "#/$defs/hookEventConfig"
        },
        "UserPromptSubmit": {
          "$ref": "#/$defs/hookEventConfig"
        },
        "Notification": {
          "$ref": "#/$defs/hookEventConfig"
        },
        "Stop": {
          "$ref": "#/$defs/hookEventConfig"
        },
        "SubagentStop": {
          "$ref": "#/$defs/hookEventConfig"
        },
        "SessionStart": {
          "$ref": "#/$defs/hookEventConfig"
        },
        "SessionEnd": {
          "$ref": "#/$defs/hookEventConfig"
        },
        "PreCompact": {
          "$ref": "#/$defs/hookEventConfig"
        }
      },
      "additionalProperties": false
    },
    "hookEventConfig": {
      "type": "array",
      "items": {
        "type": "object",
        "properties": {
          "matcher": {
            "type": "string",
            "description": "Regex pattern to match tool names"
          },
          "hooks": {
            "type": "array",
            "items": {
              "$ref": "#/$defs/hook"
            }
          }
        },
        "required": ["hooks"]
      }
    },
    "hook": {
      "type": "object",
      "properties": {
        "type": {
          "type": "string",
          "enum": ["command", "prompt", "agent"],
          "description": "Hook execution type"
        },
        "command": {
          "type": "string",
          "description": "Shell command to execute (for type: command)"
        },
        "prompt": {
          "type": "string",
          "description": "Prompt to evaluate with LLM (for type: prompt)"
        },
        "timeout": {
          "type": "integer",
          "minimum": 1,
          "description": "Timeout in seconds"
        }
      },
      "required": ["type"]
    },
    "mcpServer": {
      "type": "object",
      "properties": {
        "command": {
          "type": "string",
          "description": "Server command or binary path"
        },
        "args": {
          "type": "array",
          "items": {
            "type": "string"
          },
          "description": "Command arguments"
        },
        "env": {
          "type": "object",
          "additionalProperties": {
            "type": "string"
          },
          "description": "Environment variables"
        }
      },
      "required": ["command"]
    },
    "lspServer": {
      "type": "object",
      "properties": {
        "command": {
          "type": "string",
          "description": "Language server binary name"
        },
        "args": {
          "type": "array",
          "items": {
            "type": "string"
          },
          "description": "Arguments to pass to the server"
        },
        "extensionToLanguage": {
          "type": "object",
          "additionalProperties": {
            "type": "string"
          },
          "description": "Maps file extensions to language identifiers"
        }
      },
      "required": ["command", "extensionToLanguage"]
    }
  }
}
