{
  "name": "tarq",
  "owner": {
    "name": "Chris Tarquini",
    "email": "code@tarq.io"
  },
  "metadata": {
    "description": "Chris Tarquini's personal collection of Claude Code plugins",
    "version": "0.0.1"
  },
  "plugins": [
    {
      "name": "kickstart",
      "source": "./plugins/kickstart",
      "category": "cli",
      "tags": [
        "kickstart",
        "scaffolding",
        "scaffold",
        "template",
        "developer-tools"
      ],
      "keywords": [
        "kickstart",
        "scaffolding",
        "scaffold",
        "template"
      ]
    },
    {
      "name": "rust",
      "description": "A plugin for working with Rust projects",
      "source": "./plugins/rust",
      "category": "cli",
      "tags": [
        "rust",
        "development",
        "developer-tools"
      ],
      "keywords": [
        "rust",
        "cli",
        "developer-tools"
      ]
    },
    {
      "name": "just",
      "description": "A plugin for working with Justfiles",
      "source": "./plugins/just",
      "category": "cli",
      "tags": [
        "just",
        "development",
        "developer-tools"
      ],
      "keywords": [
        "just",
        "cli",
        "developer-tools"
      ]
    },
    {
      "name": "openai",
      "source": "./plugins/openai",
      "category": "utilities",
      "tags": [],
      "keywords": []
    },
    {
      "name": "git",
      "description": "Git workflow skills: commits, gitignore management, README updates, and changelog generation",
      "source": "./plugins/git",
      "category": "developer-tools",
      "tags": [
        "git",
        "version-control",
        "workflow",
        "developer-tools"
      ],
      "keywords": [
        "git",
        "commit",
        "gitignore",
        "readme",
        "changelog",
        "version-control"
      ]
    },
    {
      "name": "lychee",
      "description": "Link checking with lychee - CLI usage, configuration, and GitHub Actions workflows",
      "source": "./plugins/lychee",
      "category": "developer-tools",
      "tags": [
        "link-checker",
        "documentation",
        "ci-cd",
        "github-actions",
        "developer-tools"
      ],
      "keywords": [
        "link-checker",
        "lychee",
        "documentation",
        "ci-cd",
        "github-actions"
      ]
    },
    {
      "name": "deno-lsp",
      "description": "Deno Language Server integration for Claude Code",
      "source": "./plugins/deno-lsp",
      "category": "developer-tools",
      "tags": [
        "deno",
        "lsp",
        "language-server",
        "typescript",
        "javascript",
        "developer-tools"
      ],
      "keywords": [
        "deno",
        "lsp",
        "language-server",
        "typescript",
        "javascript"
      ]
    },
    {
      "name": "typst",
      "source": "./plugins/typst",
      "category": "utilities",
      "tags": [],
      "keywords": []
    },
    {
      "name": "swift-mcp-server",
      "description": "Skill for developing MCP servers in Swift using the official swift-sdk",
      "source": "./plugins/swift-mcp-server",
      "category": "cli",
      "tags": [
        "swift",
        "mcp",
        "server",
        "development",
        "developer-tools"
      ],
      "keywords": [
        "swift",
        "mcp",
        "model-context-protocol",
        "swift-sdk",
        "server"
      ]
    },
    {
      "name": "mcp-desktop-development",
      "description": "Build, validate, sign, and bundle MCP desktop extensions (.mcpb) with @anthropic-ai/mcpb",
      "source": "./plugins/mcp-desktop-development",
      "category": "developer-tools",
      "tags": [
        "mcp",
        "mcpb",
        "desktop-extension",
        "bundle",
        "claude-desktop",
        "developer-tools"
      ],
      "keywords": [
        "mcp",
        "mcpb",
        "model-context-protocol",
        "desktop-extension",
        "manifest",
        "bundle",
        "pack",
        "sign"
      ]
    },
    {
      "name": "agentic-dev",
      "description": "Personal toolkit for using Claude as a coding agent: design → bootstrap → plan → drive pipeline with structured handoff reports, ADR management, and an ADR-edit advisory hook",
      "source": "./plugins/agentic-dev",
      "category": "developer-tools",
      "tags": [
        "agentic",
        "workflow",
        "adr",
        "developer-tools"
      ],
      "keywords": [
        "agentic",
        "workflow",
        "design",
        "bootstrap",
        "adr",
        "track-plan",
        "track-drive"
      ]
    }
  ]
}
